<?xml version="1.0" encoding="UTF-8" ?>
<!--
          http://www.imesne.com
-->

<!ELEMENT mapper (sql* | insert* | update* | delete* | select* )+>
<!ATTLIST mapper
xmlns:fo CDATA #IMPLIED
namespace CDATA #IMPLIED
>

<!ELEMENT select (#PCDATA | include | trim | where | set | foreach | choose | if | bind)*>
<!ATTLIST select
id CDATA #REQUIRED
>

<!ELEMENT insert (#PCDATA | include | trim | where | set | foreach | choose | if | bind)*>
<!ATTLIST insert
id CDATA #REQUIRED
>

<!ELEMENT update (#PCDATA | include | trim | where | set | foreach | choose | if | bind)*>
<!ATTLIST update
id CDATA #REQUIRED
>

<!ELEMENT delete (#PCDATA | include | trim | where | set | foreach | choose | if | bind)*>
<!ATTLIST delete
id CDATA #REQUIRED
>

<!-- Dynamic -->
<!ELEMENT property EMPTY>
<!ATTLIST property
name CDATA #REQUIRED
value CDATA #REQUIRED
>
<!ELEMENT include (property+)?>
<!ATTLIST include
refid CDATA #REQUIRED
>

<!ELEMENT bind EMPTY>
<!ATTLIST bind
 name CDATA #REQUIRED
 value CDATA #REQUIRED
>

<!ELEMENT sql (#PCDATA | include | trim | where | set | foreach | choose | if | bind)*>
<!ATTLIST sql
id CDATA #REQUIRED
lang CDATA #IMPLIED
databaseId CDATA #IMPLIED
>

<!ELEMENT trim (#PCDATA | include | trim | where | set | foreach | choose | if | bind)*>
<!ATTLIST trim
prefix CDATA #IMPLIED
prefixOverrides CDATA #IMPLIED
suffix CDATA #IMPLIED
suffixOverrides CDATA #IMPLIED
>
<!ELEMENT where (#PCDATA | include | trim | where | set | foreach | choose | if | bind)*>
<!ELEMENT set (#PCDATA | include | trim | where | set | foreach | choose | if | bind)*>

<!ELEMENT foreach (#PCDATA | include | trim | where | set | foreach | choose | if | bind)*>
<!ATTLIST foreach
collection CDATA #REQUIRED
item CDATA #IMPLIED
index CDATA #IMPLIED
open CDATA #IMPLIED
close CDATA #IMPLIED
separator CDATA #IMPLIED
>

<!ELEMENT choose (when* , otherwise?)>
<!ELEMENT when (#PCDATA | include | trim | where | set | foreach | choose | if | bind)*>
<!ATTLIST when
test CDATA #REQUIRED
>
<!ELEMENT otherwise (#PCDATA | include | trim | where | set | foreach | choose | if | bind)*>

<!ELEMENT if (#PCDATA | include | trim | where | set | foreach | choose | if | bind)*>
<!ATTLIST if
test CDATA #REQUIRED
>